{
  "protocol": "dcp/0.2",
  "revision": 1,
  "class": "general",
  "vocabulary": "core/0.2",
  "board_id": "pricing.devtools",
  "tags": ["topic:pricing"],
  "criteria": {},
  "terms": {
    "ask": "Has anyone moved a developer tool from seats to usage-based pricing? Looking for 20 minutes on what broke."
  },
  "expires_at": "2026-10-14T18:00:00Z",
  "max_connections": 3,
  "offer_schema": {
    "required": ["interest"],
    "allowed": ["interest", "experience_summary"]
  },
  "reply_key": {
    "kty": "EC",
    "crv": "P-256",
    "use": "enc",
    "alg": "ECDH-ES",
    "x": "f83OJ3D2xF1Bg8vub9tLe1gHMzV76e8Tus9uPHvRVEU",
    "y": "x_FEzRu9m36HLN_tue659LNpXW6pCyStikYjKIWI5a0"
  }
}
